,,,,,,,,,,,,,,"Following the addition, the reactionware monolith was taken out of the ice bath and put in a preheated to 70 °C oil bath: 5 min",HeatChill,Error: No Output,,,,,,,,,,,,,,,
,,,,,,,,,,,,,,The reaction was allowed to stir for 6 hours. During these six hours the reaction mixture changed in colour by developing a slightly darker yellow hue.,Stir,Stir,,,,,,,,,,,,,,,
,,,,,,,,,,,,,,"After the 6-hour mark, compound 2 (Rf = 0.78) was still visible on TLC (1:4 MeOH: CHCl3) along with product compound 3 (Rf = 0.73): 10 min ",,,,,,,,,,,,,,,,,
,,,,,,,,,,,,,,"Thus, another equivalent of 50% H2O2 (aq.) (0.24 mL, 4.1 mmol, 1 eq.) was added to Module 3: 5 min",Add,Error: No Output,,,,,,,,,,,,,,,
,,,,,,,,,,,,,,Reaction was allowed to stir for another 2 hours at which point TLC indicated that no starting material was left: 10 min,Stir,Stir,,,,,,,,,,,,,,,
,,,,,,,,,,,,,,Material was transferred from Module 3 to Module 4: 10 min,Transfer,Error: No Output,,,,,,,,,,,,,,,
,,,,,,,,,,,,,,H2O (54 mL) was added to Module 4 and the reaction mixture was left to stir for 1 hour during which period a white precipitate started to form: 5 min,"Add, Stir","Add, Wait",,,,,,,,,,,,,,,
,,,,,,,,,,,,,,"The mixture was filtered and compound 3 was afforded as a pale-yellow powder (0.82 g, 3.0 mmol, 60% based on diphenylmethanol starting material) which was dried under vacuum overnight. 94.7% purity assessed by LCMS: 10 min","Filter, Dry","Filter, Stir, Dry",,,,,,,,,,,,,,,